ID,numericalData,numericalDataType,textData,fileData
247,,,"СМѢЛОЕ, мѣстечко Черниговскаго Намѣстничества въ Роменскомъ уѣздѣ. Здѣсь бываетъ въ году четыре ярмарки: первая Генваря 1, вторая Маія 9, третія Іюля 8, четвертая Октября 14. На оныя пригоняютъ для продажи лошадей, рогатой скотъ, какъ-то быковъ, овецъ и прочее , Малороссійскіе жители; а Рускіе купцы изъ разныхъ городовъ привозитъ всякіе мѣлочные товары.",
248,,,СОЛЬ-ВЫЧЕГОДСКЪ съ 1780 году городъ Вологодскаго Намѣстничества. Въ ономъ бываетъ въ году одна ярмарка; а въ уѣздѣ онаго бываютъ торги въ двухъ селахъ въ Бондокурском стану и въ ИльинскомЬ приходѣ на Вилюдѣ.,
249,,,"СРЕБНОЕ, мѣстечко Черниговскаго Намѣстничества въ Прилуцкомъ уѣздѣ. Въ ономъ бываетъ въ годЪ двѣ ярмарки: одна Апрѣля 23, въ день Великомученика Георгія ; другая Сентября 8, въ день Рождества Богоматери. На оныхъ торгуютъ окольные жители своими произрастѣніями , какъ-то хлѣбомъ, разнымъ скотомъ, съѣстными припасами , всякою посудою , сѣномъ, дегтемъ и прочими мѣлочми. Здѣсь бываютъ также еженедѣльные торжки въ понедѣльникъ и пятокъ.",
250,,,"СТАВРОПОЛЬ, съ 1780 году городъ Синбирскаго Намѣстничества. Въ ономъ бываетъ одинъ базарной день во вторникъ.",
251,,,"СТАРАЯ РЯЗАНЬ, слобода Рязанскаго Намѣстничества. Въ оной бываетъ Іюня 29 дня для крестьянъ годовая ярмарка.",
252,,,"СТАРИНСКОЕ, село Синбирскаго Намѣстничества въ Курмышскомъ уѣздѣ. Здѣсь бываетъ ярмарка Іюля 8 дня.",
253,,,"СТОЯНЦЫ , село Тверскаго Намѣстничества въ Кашинскомъ уѣздѣ. Здѣсь бываетъ въ годъ одинъ торжокъ, на которой товары привозятъ изъ уѣзду, холсты льняные разные, да изъ городовъ Ярославля, Переславля Залѣскаго , Углича пріѣзжаютъ купцы съ мѣлочными всякими небогатыми товарами.",
254,,,"СУДАЙ, слобода Костромскаго Намѣстничества въ Галицкой Провинціи. Въ оной бываетъ въ году три ярмарки: первая Ноября 21, вторая Ген-варя 6, третія Марта 25 чиселъ. Здѣсь торгуютъ конскими и скотскими кожами , также и овчинами , разною мягкою рухлядью , а большею частію бываютъ бѣлки; также въ уѣздѣ онаго города при церкви Пророка Иліи , что на Высокѣ, имѣется годовой же торгъ.",
255,,,"СУДЖА , съ 1779 году городъ Курскаго Намѣстничества. Въ ономъ бываетъ въ году четыре ярмарки : Апрѣля 23, въ день Великомученика Георгія; Іюня 29, въ день Апостолъ Петра и Павла; Октября 1, въ день Покрова, да въ Рождественской мясоѣдъ на всеѣдной недѣлѣ по два дни; пріѣзжаютъ на оныя купцы изъ сосѣдственныхъ городовъ ; привозятъ шелковые бумажные и прочіе товары небольшимъ числомъ.",
256,,,"СУХАРИ, мѣстечко Могилевскаго Намѣстничества въ Чауской округѣ. Тутъ бываетъ одна въ году ярмарка.",
257,,,"СѢВСКЪ, съ 1778 году городъ Орловскаго Намѣстничества. Въ ономъ бываетъ въ году одна ярмарка, исключая обыкновенныхъ торговъ.",
258,,,"ТАРУСА, съ 1777 году городъ Калужскаго Намѣстничества. Въ ономъ бываетъ годовая ярмарка въ день Святыхъ Апосгполъ Петра и Павла ; пріѣзжаютъ на оную купцы съ мѣлкими товарами и съѣстными изъ ближнихъ городовъ Серпухова и Алексина, а уѣздные люди съ крестьянскими припасами.",
259,,,"ТИСКАДЫ, мѣстечко Полотскаго Намѣстничества въ уѣздѣ города Динабурга. Въ немъбываетъ въ году три ярмарки, на коихъ торгуютъ Рижскаго Дворца крестьяне разными мѣлочными товарами, виномъ и пивомъ.",
260,,,"ТИХВИНЪ, съ 1776 году городъ Новогородскаго Намѣстничества. Въ ономъ бываетъ въ году три ярмарки: первая въ первое Воскресенье великаго поста , а другія двѣ въ лѣтнее и осеннее время.",
261,,,"ТИХОНОВА , пустыня Калужскаго Намѣстничества и уѣзду. Здѣсь бываетъ годовая ярмарка Іюня 18 дня , на которую съѣжаются купцы изъ Калуги и Малаго Ярославца.",
262,,,"ТОМАРОВКА, слобода въ уѣздѣ города Карпова. Въ оной бываетъ ярмарка послѣ Рождества на всеѣдной недѣлѣ въ пятницу, Маія 9, Іюля 8, Декабря 6, и продолжаются оныя по одному дню. Купцы пріѣзжаютъ изъ окрестныхъ городовъ съ мѣлочными товарами.",
263,,,"ТОРОПЕЦЪ, съ 1777 году городъ Псковскаго Намѣстничества. Въ немъ случается въ году одна указная ярмарка въ Iюлѣ мѣсяцѣ въ пятокъ, предъ праздникомъ Пророка Иліи, на которую по большей части съѣзжаются крестьяне изъ ближнихъ деревень съ мѣлочнымъ крестьянскимъ товаромъ и рукодельемъ.",
264,,,"ТРОИЦКЪ, съ 1780 году городъ Пензенскаго Намѣстничества. Въ немъ бываетъ ярмарка Іюня 29 дня, сверхъ обыкновенныхъ каждонедѣлъныхъ торговъ.",
265,,,"ТРОИЦКАЯ , треть Вологодскаго Намѣстничества. Здѣсь бываютъ ярмарки Генваря 1, 5, 6 и 18, да Марта 17 и 25 чиселъ, на которыхъ въ оной у сосѣднихъ поселянъ здѣшніе купцы покупаютъ масло коровье, сало, кожи говяжьи и бараньи, медвѣжьи, волчьи, заячьи, бѣльи, полотна, холсты, сукна сермяжныя и дичину.",
266,,,"ТЮРТЕНЬ, село Орловскаго Намѣстничества въ Елецкомъ уѣздѣ. Здѣсь бываетъ Іюля въ 8 день ярмарка; торгуютъ Елецкіе и другихъ городовъ купцы съ уѣздными обывателями всякими разными мѣлочными товарами и дегтемъ; а обыватели продаютъ купцамъ и своей братьи лошадей , скотину , холстъ, съѣстные всякіе припасы и рукодѣлія.",
267,,,"УГЛИЧЪ, съ 1777 году городъ Ярославскаго Намѣстничества. Здѣсь бываютъ двѣ ярмарки: первая Іюля 8 , три дни,вторая Декабря 26 чиселъ, одинъ день; на оныя пріѣзжаютъ купцы изъ Ярославля, Кашина и Переславля-Залѣскаго съ шелковыми, бумажными, москотильными и прочими товарами; а изъ уѣзду съѣзжается крестьянство со льнянымъ и хряще вымъ холстомъ, съ мясами, кожами и саломъ. Да и въ уѣздѣ онаго бываютъ годовые торжки въ одинадцати селахъ, а ярмарки въ четырехъ, а именно: Прилукахъ, Рожественѣ, Кею и Некоузѣ; торгуютъ пріѣзжіе изъ Углича, Кашина и Бѣжецка купцы мѣлкими москотильными и шелковыми товарами; самижь покупаютъ хлѣбъ, холстъ, пряжу, шерсть и шерстяныя сукна, масло, а зимою свиныя и говяжьи мяса, боевыя кожи и сало.",
268,,,"УРАЗОВА , слобода Воронежскаго Намѣстничества въ уѣздѣ города Валуекъ. Въ оной бываетъ въ году семь ярмарокъ.",
269,,,"УРАЛЬСКЪ, главный городъ уральскихъ Козаковъ въ Кавказскомъ Намѣстничествѣ. Здѣсь бываютъ ярмарки въ Іюнѣ , Іюлѣ, въ Сентябрѣ, Октябрѣ, въ Генварѣ и Февралѣ мѣсяцахъ; пріѣзжаютъ разныхъ городовъ купцы, привозятъ хлѣбъ, шелковые и бумажные товары, шерстяныя матеріи , сукна и прочее; здѣсь покупаютъ разныхъ родовъ рыбу, икру , клей , степныхъ звѣрей, какъ-то лисицъ, волковъ, зайцовъ, кушаки и сермяжныя полотна.",
270,,,"УСТИВИЦА, мѣстечко Кіевскаго Намѣстничества въ Миргородскомъ уѣздѣ. Въ ономъ бываетъ въ году сверхъ еженедѣльныхъ торговъ двѣ ярмарки: первая Іюля 20, вторая Октября 26; торгуютъ на оныхъ пріѣзжіе изъ уѣзду жители разными мѣлочными товарами, тамъ родящимися, какъ-то хлѣбомъ , горячимъ виномъ, разнымъ скотомъ, овчинами , кожами и проч. Иногда пріѣзжаютъ и Великороссійскіе купцы съ краснымъ товаромъ.",
271,,,"УСТЬ-СЫСОЛЬСКЪ, съ 1780 году городъ того же Намѣстничества. Здѣсь бываетъ ярмарка Ноября съ 26 по 29 число; скупаютъ купцы у промышлениковъ мягкую рухлядь.",
272,,,"УСТЮГЪ ВЕЛИКІЙ, съ того же году городъ того же Намѣстничества. Въ немъ бываетъ ярмарка Іюля 8 дня въ день Прокопія устюжскаго Чудотворца , на которой бываютъ по большей части Велико-Устюжскаго уѣзда крестьяне съ своими пріуготовленіями.",
273,,,"ФАТЕЖЪ, съ 1779 году городъ Курскаго Намѣстничества. Въ немъ торговой день для окольныхъ поселянъ бываетъ въ Воскресенье.",
274,,,"ФЕЛЛИНЪ, съ 1783 году городъ Рижскаго Намѣстничества. Здѣсь ярмарка бываетъ въ году одна за недѣлю Михайлова дни, и та не важна , только почти что для крестьянства; около живущіе дворяне съѣзжаются больше въ Ревелѣ, Перновѣ и Дерптѣ.",
275,,,"ХВАЛЫНСКЪ, съ 1780 году городъ Саратовскаго Намѣстничества. Здѣсь бываетъ яр-марка Іюня 28 дня , на которую по большей части съѣжается крестьянство.",
276,,,"ХЕРСОНЪ, съ 1784 году городъ Екатеринославскаго Намѣстничества. Здѣсь Россійскіе купцы съ Цареградскими Греками и другими торгуютъ Европейскими и Азіатскими товарами, получая и отпуская за море на корабляхъ.",
277,,,"ХОВАНЬ, сельцо Московской Губерніи въ Волоколамскомъ уѣздѣ. Здѣсь бываетъ одна въ году ярмарка въ Іюлѣ мѣсяцѣ , на которой торгуютъ одинъ день разными крестьянскими товарами.",
278,,,"ХОТЕНЬ , село Харьковскаго Намѣстничества въ Сумскомъ уѣздѣ. Въ ономъ бываютъ въ году три ярмарки; на которыя купцы пріѣзжаютъ съ мѣдочными товарами и горячимъ видомъ.",
279,,,"ЧЕРЕПОВЕЦЪ, съ 1776 году городъ Новогородскаго Намѣстничества. Въ немъ бываютъ три годовыя ярмарки: первая Генваря 11, называемая Ѳеодосіевская, вторая Сентября 25, Сергіевская, третія Ноября 26, Георгіевская. Сюда пріѣзжаютъ купцы изъ разныхъ Россійскихъ городовъ съ разными товарами.",
280,,,"ЧЕРНУХИ, мѣстечко Черниговскаго Намѣстничества. Въ немъ бываетъ въ году четыре ярмарки: первая въ день Святыя Троицы, другая Августа 15, третія Декабря 6, четвертая великаго поста на пятой недѣлѣ ; торгъ бываетъ привозимыми изъ уѣздовъ товарами, какъ-то саломъ, рыбою, дегтемъ горячимъ виномъ, нагольными овчинами , шубами , говяжьими кожами, печенымъ хлѣбомъ, съѣстными припасами и другими мѣлочными товарами.",
281,,,"ЧЕЧЕРСКЪ, мѣстечко Могилевскаго Намѣстничества въ уѣздѣ города Рогачева. Здѣсь бываетъ въ году три ярмарки: первая Генваря 8, вторая Сентября 8, третія въ день Вознесенія.",
282,,,"ЧУГУЕВЪ, съ 1780 году городъ Харьковскаго Намѣстничества. Въ ономъ бываетъ ярмарка въ день Преображенія Господня, на которую пріѣзжаютъ со всякими шелковыми и прочими товарами изъ Москвы и изъ другихъ городовъ купцы , такожь и крестьяне.",
283,,,"ЧУПАХОВКА, слобода около бывшаго городка Алешни. Въ оной бываютъ три ярмарки : первая Апрѣля 23, вторая Сентября 8, третія Ноября 21 дня. На оныя пріѣзжаютъ купцы изъ близъ лежащихъ городовъ; торгуютъ сукнами , шелковыми , бумажными и набойчатыми товарами , желѣзомъ , полотномъ, посудою и прочимъ.",
284,,,"ШАМОВО, мѣстечко Могилевскаго Намѣстничества въ Мстиславскомъ уѣздѣ. Въ немъ бываетъ одна ярмарка въ году.",
285,,,"ШУМЯЧИ, мѣстечко Могилевскаго Намѣстничества въ Климовицкомъ уѣздѣ. Здѣсь бываютъ двѣ ярмарки въ году.",
286,,,"ЮНАКОВКА , село Харьковскаго Намѣстничества въ Сумскомъ уѣздѣ. Здѣсь бываетъ въ году четыре ярмарки; на оныя купцы пріѣзжаютъ съ мѣлочными товарами и съ горячимъ виномъ.",
287,,,"ЯГОТИНЪ, мѣстечко того же Намѣстничества въ Переяславскомъ уѣздѣ. Въ ономъ бываетъ въ году четыре ярмарки: первая въ Похвальную субботу, вторая въ день Великомученика Георгія, третія въ день Преображенія , четвертая въ день Архистратига Михаила. Купцы пріѣзжаютъ изъ близъ лежа* щихъ городовъ съ красными, крамными и прочими товарами, стеклянною и деревянною посудою, съѣстными припасами; жители продаютъ рогатой скотъ, лошадей, хлѣбъ, смолу, горячее вино и проч. Привозятъ также сюда для продажи жителямъ Крымскую соль.",
288,,,"ЯДРИНЪ, съ 1781 году городъ Казанскаго Намѣстничества. Въ ономъ городѣ и въ уездѣ ярмарокъ нѣтъ, а бываютъ торжки малые въ каждой недѣлѣ по одному дню; товаръ бываетъ крестьянской , а заморскихъ товаровъ въ приводѣ не бываетъ.",
289,,,"ЯМПОЛЬ, слобода Харьковскаго Намѣстничества въ Изюмскомъ уѣздѣ. Здѣсь бываютъ въ году три ярмарки: первая Маія 9, въ день Чудотворца Николая , вторая Ноября 1, въ день Козмы и Даміана, третія Декабря 6, въ день Чудотворца Николая; купцы пріѣзжаютъ на оныя изъ разныхъ городовъ съ шелковыми и прочими товарами.",
290,,,"ЯМСКАЯ, слобода Пензенскаго Намѣстничества въ Инсарскомъ уѣздѣ. Здѣсь бываетъ годовая ярмарка въ девятую пятницу; на оную пріѣзжаютъ купцы изъ близъ лежащихъ городовъ съ недорогими товарами.",
291,,,"ПОДОЛЪ, городъ Московской Губерніи. Въ немъ каждую недѣлю по субботамъ бываетъ торгъ , на которой съѣзжается крестьянство съ своими произрастѣніями , издѣльями и съѣстными припасами;",
292,,,"КЛИНЪ, городъ Московской Губерніи. Въ ономъ бываетъ годовая ярмарка предъ пятницею въ субботу; на оную пріѣзжаютъ изъ другихъ уѣздовъ, и еженедѣльно торгуютъ въ субботу разными крестьянскими товарами , колесами и всякою деревянною посудою и прочими съѣстными припасами; частію бываютъ и купцы изъ нѣкоторыхъ окрестныхъ городовъ съ мѣлочными шелковыми и бумажными товарами.",
293,,,"АВДУЛОВО, ИВАНОВСКОЕ тожь, село Рязанскаго Намѣстничества въ Донковскомъ уѣздѣ, Здѣсь бываетъ одна годовая ярмарка въ день Іоанна Воина, то есть Іюля 30, на которую пріѣзжаютъ купцы и крестьяне съ мѣлочными товарами.",
294,,,"АНДРЕЕВКА, слобода Харьковскаго Намѣстничества въ Изюмскомъ уѣздѣ ; въ оной бываетъ въ году двѣ ярмарки : первая Іюля 20, въ день Пророка Иліи, вторая Октября 26, въ день Великомученика Димитрія. Купцы на оныя пріѣзжаютъ изъ разныхъ Росссійскихъ городовъ съ шелковыми , бумажными , гарусными и прочими товарами.",
295,,,"АЛЕКСѢЕВКА, слобода Графа Шереметева, въ Воронежскомъ Намѣстничествѣ около слободы же Усерда. Здѣсь бываетъ въ годъ четыре ярмарки: первая на день Алексія человѣка Божія, вторая о Троицкой недѣлѣ , третія въ Воздвиженіе честнаго Креста, четвертая на день святыхъ мученикъ Космы и Даміана Ноября 1 дня; иностранныхъ купцовъ не бываетъ, а пріѣзжаютъ Россійскіе съ разными товарами.",
296,,,"ШАДРИНСКЪ, съ 1781 году городъ Пермскаго Намѣстничества. Въ ономъ бываетъ въ году три ярмарки: первая Іюня 29, вторая Ноября 3, третія въ первое Воскресеніе вели-каго поста; на оныхъ торгуютъ мѣлочными товарами.",
297,,,"ПОКРОВСКОЕ , ЛЮБОША тожь, село Орловскаго Намѣстничества въ Ливенскомъ уѣздѣ. Въ ономъ бываетъ годовая ярмарка 15 Іюля; пріѣзжаютъ сюда окрестные купцы съ шелковыми и другими мѣлочными товарами, также и крестьяне.",
298,,,"ТРОИЦКОЕ, село Московской Губерніи въ Звенигородскомъ уѣздѣ. Въ немъ бываетъ ярмарка о Троицынѣ дни.",
299,,,"ИЛЬИНСКОЕ, село Тульскаго Намѣстничества въ Каширскомъ уѣздѣ. Здѣсь бываютъ торжки каждонедѣльно въ пятничные дни ; товары на оные привозятъ изъ уѣзда холсты льняные разные, да изъ городовъ Ярославля, Переславля Залѣснаго и Углича пріѣзжаютъ купцы съ мѣлочными всякими небогатыми товарами.",
300,,,"РОЖЕСТВЕНСКОЕ, село Тульскаго Намѣстничества въ уѣздѣ города Ефремова. Здѣсь бываетъ одна годовая ярмарка 21 Сентября ; на оную съѣзжаются купцы изъ окрестныхъ городовъ съ разными товарами, и то по большей части съ мѣлочными , а крестьяне съ своими рукодѣліями.",
301,,,"ИВАНОВСКОЕ, село Московской Губерніи въ Звенигородскомъ уѣздѣ. Въ семъ селѣ бываетъ ярмарка каждогодно Іюля 8 дня.",
302,,,"СПАСКОЕ, село Ярославскаго Намѣстничества въ Пошехонскомъ уѣздѣ. Здѣсь бываетъ годовая ярмарка въ день Преображенія, и продолжается два дни.",
303,,,"СЕМЕНОВСКОЕ , село Ярославскаго Намѣстничества въ Пошехонскомъ уѣздѣ. Здѣсь 6ы-ваетъ годовая ярмарка въ десятую пятницу послѣ Пасхи, и продолжается три дни.",
