ID,numericalData,numericalDataType,textData,fileData
1,,,"АРХАНГЕЛЬСКЪ, главный городъ Намѣстничества сего имени. Въ немъ бываетъ каждой годъ ярмарка , которая начинается въ Маіѣ мѣсяцѣ съ приходомъ изъ Россіи барокъ, а изъ за моря кораблей; прямая же, или валовая начинается всегда въ Іюнѣ, а оканчивается въ первыхъ числахъ Октября ; на ней бываетъ торговля ме-жду иностранными и Россійскими купцами Россійскими и иностранными товарами , продолжающаяся во время мореплаванія, на которую ярмарку иностранные купцы всякіе иностранные товары чрезъ море на корабляхъ изъ чужихъ краевъ къ Архангельскому порту привозятъ; а Россійскіе въ тѣ мѣста отпускаютъ всякіе привозимые чрезъ верховые города водою и сухимъ путемъ Россійскіе, Китайскіе, Персидскіе, Турецкіе и прочіе Азіатскіе и другіе иностранные товары для народнаго употребленія, а не въ отвозъ въ чужіе край, а именно же: привозимыя вина Французскія, Португальскія, Гишпанскія и Нѣмецкія лучшія и ординарныя, ромъ, уксусъ, водка венгерская, еликсиръ , винной, камень , сукна Голландскія , Аглинскія , Гамбурскія, Шлезскія и прочія лучшія и ординарныя, лоскутья и покроми суконныя , стамеды , штофы и прочія тому подобныя шерстяныя матеріи ; штофы и прочія шелковыя и полушелковыя парчи и ленты , выбойки , полотна Голландскія, олово въ блюдахъ и торѣлкахъ и прочихъ мѣдочахъ , прутовое и въ слиткахъ , свинецъ, желѣзо листовое , иглы , ножи , вилки , ножницы и прочіе желѣзные товары; квасцы, ртуть, сѣра горючая , шелакъ, шпіатеръ, масло деревянное, винныя ягоды , изюмъ , коринка , смоквы, черносливъ, ядры мигдальныя , кофе , чай , перецъ , орѣшки чернильныя , сандалъ, сахаръ, лимоны, померанцы и прочіе фрукты свѣжіе и въ винѣ; гвоздика, корица и прочія пряныя зелья ; канфара, ладонъ росной и простой, изъ гумми разныхъ сортовъ; посуда стеклянная, цѣнинная и каменая , стеклы окончинныя и бутылки , сыры , патока черная, пшено сорочинское , свѣтильня бумажная, бобры, выдры, лисицы; краски , консель брусковая, киноварь, оринакъ; чулки шелковые и шерстяные , также и прочіе отпускные , какъ - то: хлѣбъ , сѣмя льняное, сало говяжье и ворванная смола, юфть, желѣзо полосное и гвозди желѣзные , пенька, ленѣ , рогожии кульки рогожные ; щетина , канаты и веревки пеньковыя и пакальныя , пряжа канатная, воскъ, гривы конскія , кости , кожи моржевыя , мыло ; мягкая рухлядь , куницы , горнаcтаи , россомахи , бѣлки , песцы, зайчины , мѣхи бѣльи и заячьи , кожи медвежьи, кошечьи и волчьи; полотна гладкія и салфеточныя широкія и узкія и брань уѣздной работы, Фламскія парусныя и равендукъ холстъ , хрящъ, посуда деревянная, свѣчи сальныя, языки говяжьи копченые, губа лиственная , клей Сибирской, кожи подошевныя и ворванныя, сукна сермяжныя и чирковыя туфли, чаи жуланъ и простой, бадьянъ, масло коровье льняное и конопляное, медъ сырецъ, рога оленьи , мясо говяжье соленое , семга соленая , пряники медовые.",
2,,,"ВОРОНЕЖЪ, главный городъ Намѣстничества сего имени. Въ немъ, кромѣ еженедѣльныхъ по понедѣльникамъ , середамъ и пятницамъ торговъ , бываютъ въ году двѣ ярмарки: первая въ городѣ о десятой пятницѣ , а послѣдняя при слободѣ Чижовкѣ въ 29 день Августа.",
3,,,"ВЫБОРГЪ, главный городъ Намѣстничества сего имени. Въ ономъ бываетъ въ каждое лѣто ярмарка, какъ въ городѣ приморскомъ; отсюда за море отпускаютъ доски, смолу , желѣзо , а получаютъ соль, табакъ , вина и прочее. Сверхъ сего бываетъ въ году еще двѣ ярмарки: первая Августа 24 вторая Сентября 21, на которыякрестьяне привозятъ по большей части рогатой скотъ, лошадей и съѣстные припасы.",
4,,,"ИРКУТСКЪ, главный городъ Намѣстничества сего имени. Здѣсь бываютъ въ году двѣ ярмарки: первая съ 15 Марта по 1 Маія, вторая Ноября съ 15 Генваря по 1, въ которыя состоитъ торговля разными Россійскими и Китайскими товарами между Иркутскими и иногородными купцами.",
5,,,"АСТРАХАНЬ , городъ Кавказскаго Намѣстничества. Въ семъ городѣ бываетъ ярмарка каждолѣтно; Россійскіе купцы, Армяне и Татары торгуютъ съ Персіанами, Армянами, Индѣйцами и прочими, разными Европейскими и Азіатскими товарами.",
6,,,"КОСТРОМА , главный городъ Намѣстничества сего имени. Здѣсь бываютъ повсягодно въ девятую и въ десятую недѣли по Пасхѣ ярмарки, и въ каждой недѣлѣ торговыхъ два дни, въ середу и пятокъ; пріѣзжаетъ на оныя по боль-шей части крестьянство ; привозятъ изъ окрестныхъ мѣстъ холстъ , пряжу , хлѣбъ и прочіе крестьянскіе товары.",
7,,,"ПОЛОТСКЪ, главный городъ Намѣстничества сего имени. Въ немъ бываютъ въ году четыре ярмарки : первая на Богоявленіе , вторая въ первую недѣлю великаго поста, третія въ пятокъ передъ Петровымъ днемъ, четвертая въ недѣлю передъ Рождествомъ Христовымъ. На оныхъ торгуютъльномъ, пенькою, лѣсами, хлѣбомъ, медомъ, воскомъ, поташемъ и скотомъ.",
8,,,"САРАТОВЪ, главный городъ Намѣстничества сего имени. Въ немъ бываетъ ярмарка Іюля 8 числа отъ съѣзду крестьянъ изъ ближнихъ селеній для продажи и покупки имъ нужныхъ вещей , болѣежь съѣзжаются Калмыки для продажи Калмыцкихъ лошадей , кои продаютъ они рублей по 16 и больше, которыя высоки бываютъ ростомъ, и ходятъ иноходью; ошъ Россіанъ же Калмыки покупаютъ между прочимъ хлѣбъ, а болѣе сукна и шелковыя матеріи для одѣваніи своихъ женъ.",
9,,,"СИНБИРСКЪ, съ 1782 году главный городъ Намѣстничества сего имени. Въ немъ, кромѣ повседневныхъ особливыхъ торговъ, бываетъ Іюля съ 5 по 8 число годовая ярмарка.",
10,,,"СМОЛЕНСКЪ, съ 1775 год главный городъ Намѣстничества сего имени. Въ ономъ ярмарокъ нѣтъ, а пріѣзжаютъ въ торговые дни въ среду и пя-токъ изъ уѣздовъ разныхъ Помѣщиковъ крестьяне съ раз-нымъ хлѣбомъ , пенькою, медомъ ; а въ Воскресенье хотя и бываетъ крестьянство съ такимижь товарами, токмо малое число.",
11,,,"ТАМБОВЪ, съ 1779 году главный городъ Намѣстничества сего имени. Здѣсь бываютъ въ годъ два съѣзда, сверхъ обыкновенныхъ торговъ: первой въ Іюнѣ мѣсяцѣ о десятой пятницѣ; второй для богомолія Казанской Богородицѣ 8 Іюля, и сіи торги продолжаются дни по два.",
12,,,"ТВЕРЬ, съ 1775 году главный городъ Намѣстничества сего имени. Здѣсь торги бываютъ дважды во вторникъ и въ четвертокъ; а въ Тверскомъ уѣздѣ въ Микульскомъ стану, въ отчинѣ Князя Мещерскаго , въ селѣ Лотошинѣ, въ недѣлѣ по единожды по воскреснымъ днямъ, и привозятъ разныхъуѣздовъ и деревень крестьяне въ оные торговые дни товары домовые своей работы, пеньку, хлѣбъ, масло и прочіе мѣлочные.",
13,,,"ТОБОЛЬСКЪ, съ 1782 году главный городъ Намѣстничества сего имени. Купцы Россійскіе, въ Сибири и на Китайскую границу торгующіе, Тобольска не минуютъ. Зимою съ обѣихъ сторонъ есть проѣздъ непрестанной ; весною отправляютъ по рѣкамъ на судахъ въ Енисейскъ и до Иркутска, а осенью оттуда водянымъ же путемъ пріѣзжаютъ. И такъ бываетъ въ Тобольскѣ дважды въ годъ ярмарка: весною Россійскимъ, а осенью Сибирскимъ и Китайскимъ товарамъ. Купцы пріѣздъ еще имѣютъ съ товарами изъ Ирбитской ярмарки, и торгъ содержатъ Марта съ 20 Маія по 25 число, въ томъ числѣ пріѣзжаютъ и Греки.",
14,,,"ТУЛА, съ 1777 году главный городъ Намѣстничества сего имени. Здѣсь ярмарка бываетъ въ году два раза: I) при церкви Покрова Пресвятыя Богородицы , въ десятую отъ Святой недѣли пятницу; вторая Іюня 8 дня, при состоящемъ за городовымъ замкомъ Казанскомъ Соборѣ. Для складки привозимыхъ товаровъ имѣются подъ Тульскимъ Магистратомъ въ нижнемъ департаментѣ, также и особь построенныя палатки. Съ товарами на ярмарки постороннаго съѣзда не бываетъ, а отправляются только тамошними. Въ недѣлѣ два торга, въ понедѣльникъ и четвертокъ.",
15,,,"АЛАТЫРЬ, городъ Синбирскаго Намѣстничества. Въ уѣздѣ сего города бываетъ годовыхъ семь ярмарокъ.",
16,,,"АЛЕКСИНЪ, городъ Тульскаго Намѣстничества. Здѣсь бываютъ двѣ въ году ярмарки: первая Іюля 1, вторая Августа 29 дня. На оныя пріѣзжаютъ съ разными москотильными товарами.",
17,,,"АРЗАМАСЪ, городъ Нижегородскаго Намѣстничества. Здѣсь обыкновенно бываетъ торговыхъ въ недѣлѣ два Дни.",
18,,,"АХТЫРКА , городъ Харьковскаго Намѣстничества; въ немъ бываетъ четыре ярмарки: первая о всеѣдной недѣлѣ, вторая Маія 9, третія Іюля четвертая Октября 28 дня; купцы пріѣзжаютъ изъ раз ныхъ городовъ, привозятъ парчи , шелковыя матеріи и серебро въ дѣлѣ; торгуютъ также скотомъ , лошадьми и прочимъ.",
19,,,"БѢЖЕЦКЪ, городъ Тверскаго Намѣстничества. Въ немъ бываетъ ярмарка , начинающаяся Іюня сь 30, и продолжающаяся до 5 Іюля; пріѣзжаютъ купцы изъ смѣжныхъ городовъ; привозятъ товары шелковые и прочіе москотильные мѣлочные и желѣзные. Здѣсь же бываютъ въ понедельникъ и четвертокъ торжки. Въ уѣздѣ онаго находятся ярмаркижь въ селахъ у Спаса на Холму Кесовѣ горѣ, Молодовѣ и Порѣчьѣ, въ которыхъ и еженедѣльные торги бываютъ, на Холму во вторникъ, въ Молодовѣ въ среду , а въ Кесовѣ и Порѣчьѣ въ пятницу. Въ селахъ же Поводневѣ и Шипинѣ годовыя ярмарки бываютъ на 14 число Сентября; а въ селѣ Кесовѣ горѣ на 24 число Іюня , на которыя отъ уѣздныхъ обывателей привозится всякой хлѣбъ и прочіе сырейные и съѣстные товары; а изъ прочихъ городовъ отъ обывателей уѣздныхъ мѣлочные товары, кромѣ что въ Кесову гору никуда не ѣздятъ.",
20,,,"БѢЛГОРОДЪ, городъ Курскаго Намѣстничества. Въ ономъ бываютъ три годовыя ярмарки: первая послѣ Святой недѣли въ десятую пятницу, вторая въ день Апостоловъ Петра и Павла, третія въ день Успвія Богородицы; да въ уѣздѣ онаго города бываютъ годовые торги въ Помѣщичьихъ слободахъ въ Петровской Мацвева, въ Троицкой Матюшкина, въ Сабыниной Брылкиной, въ Шебе-киной Графа Генрикова, въ Алексѣевкѣ , Корчіюкъ тожь, економической , въ Зимовѣйкѣ и Бѣлей Князя Трубецкаго, въ Ефремовкѣ Герсевановой, въ Козмодемьянской Камышина, въ Михайловкѣ , Бекорюковка тожь , Бекорюкова, въ Вознесенской , Ивановка тожь , Бакшеева. Купцы на оные торги пріѣзжаютъ изъ близъ лежащихъ городовъ съ мѣлочными лавочными товарами.",
21,,,"БѢЛОЗЕРСКЪ, городъ Новогородскаго Намѣстничества. Въ немъ въ зимнее время бываютъ каждую недѣлю по понедѣльникамъ съѣзды , на которыхъ торгуетъ крестьянство разными ихъ домовными издѣльями , также привозятъ мя сѣно и хлѣбъ.",
22,,,"ВАЛУЙКИ, городъ Воронежскаго Намѣстничества. Въ ономъ бываетъ въ году ярмарка, называемая Петровская; да въ уѣзДѣ въ слободахъ бываютъ ярмарки , въ Уразовой семь , въ Николаевкѣ четыре , въ Погромцѣ пять , въ Венделевкѣ три , въ Бѣлокуриной двѣ, въ Деркулѣ три.",
23,,,"ВЕНЕВЪ, городъ Тульскаго Намѣстничества. Въ семъ городѣ бываетъ годовая ярмарка въ десятую пятницу по Пасхѣ; торгуютъ иногородные купцы разными товарами.",
24,,,"ВЕРЕЯ, городъ Московской Губерніи и Провинціи. Въ ономъ бываетъ въ году одна ярмарка Іюня 23 дня въ день Владимерскія Богоматери, и продолжается три дни ; на оную пріѣзжаютъ купцы изъ Москвы , Тулы , Калуги, Серпухова , Можайска , Боровска и прочихъ ближнихъ городовъ; привозятъ шелковые, бумажные, москотильные и прочіе товары небольшимъ числомъ , а по большей части съѣзжаются крестьяне съ льнянымъ и хрящевымъ холетомъ, колесами, лыками и съ другимъ мѣлочнымъ товаромъ.",
25,,,"ВЕРХНІЙ УДИНСКЪ, городъ Иркутскаго Намѣстничества. Въ немъ бываютъ въ году двѣ ярмарки : первая Февраля съ 15 до половины Марта, а вторая Іюня съ 15 до половины Іюля ; торговля и промыслъ на оныхъ состоитъ изъ разныхъ привозимыхъ изъ Иркутска и другихъ городовъ купцами Россійскихъ и Нѣмецкихъ товаровъ, на которые вымѣниваютъ у здѣшнихъ иновѣрцовъ пушные товары , рогатой скотъ, лошадей и проч. и отвозятъ чрезъ Троицкую крѣпость въ Кяхту для промѣну Китайцамъ.",
26,,,"ВОЛОКОЛАМСКЪ, городъ Московской Губерніи и Провинціи. Въ ономъ бываетъ годовая Іюня 29 дня ярмарка. Пріѣзжаютъ изъ разныхъ городовъ и уѣздовъ съ разными крестьянскими и щепетильными мѣлкими товарами , также съ хлѣбомъ, сохами, косами, серпами и проч. сверхъ сего въ уѣздѣ онаго торжки бываютъ еженедѣльно: 1) въ селѣ Ярополчѣ въ пятокъ, 2) въ селѣ Ивашковѣ въ субботу, з ) въ селѣ Середѣ Стратилатовской въ середу. Годовыя ярмарки отправляются , 1) въ селѣ Ярополчѣ въ десятую пятницу, 2) въ селѣ Середѣ Стратилатовской Іюня 8 дня , 3 ) У Левкіева монастыря Августа 15 дня, 4) у Іосифове монастыря въ день Пятидесятницы и Сентября 8 дня,5) въ деревнѣ Беркуновѣ въ девятую путницу, 6) въ селѣ Бѣлой Колпи Августа 19 дня, 7) въ селѣ Раменьѣ Іюня дня, 8 ) въ селѣ Черлянковѣ Маія 9 дня, 9) въ селѣ Ховани Іюля 20 дня , 10) въ селѣ Муриковѣ Сентября 25 дня, 11) въ селѣ Снировѣ Ноября 21 дня. На сихъ ярмаркахъ торгуютъ по одному дню разными крестьянскими товарами.",
27,,,"ГАДЯЧЬ, городъ Черниговскаго Намѣстничества. Въ ономъ бываетъ въ году четыре ярмарки: первая Генваря 6, въ день Св. Богоявленія, вторая Апрѣля 23, въ день Св. Великомученика Георгія, третія Іюня 29, въ день Св. Апостоловъ Петра и Павла, четвертая Октября 14, въ день Преподобныя Параскевы. На оныхъ ярмаркахъ и въ торговые еженедѣльные дни торгуютъ хлѣбомъ, медомъ, воскомъ, табакомъ , саломъ, волною , горячимъ виномъ , лошадьми, рогатымъ скотомъ, овцами и прочею мѣлочью.",
28,,,"ГОРОХОВЕЦЪ, городъ Владимерскаго Намѣстничества. Здѣсь ярмарокъ нѣтъ, а бываетъ одна, разстояніемъ отъ онаго въ двадцати четырехъ верстахъ за рѣкою Клязьмою при Флорищевской пустынѣ прежде пра здника успенія Пресвятыя Богородицы дней за пять, на которую привозятъ холстъ и прочіе мѣлочные Россійскіе товары.",
29,,,"ДИНАБУРГЪ, городъ Полотскаго Намѣстничества, Въ семъ городѣ положено по привиллегіи три въ году ярмарки: первая Генваря 6, вторая Іюня 24, третія Сентября 8; но нынѣ ихъ не бываетъ ; въ уѣздѣ же сего города въ пятидесяти шести селахъ бываютъ; только торги, на коихъ тутошніе жители и Рижскіе обыватели торгуютъ мѣлочными Нѣмецкими товарами.",
30,,,"ДМИТРОВЪ, городъ Московской Губерніи. Въ ономъ бываетъ въ году одна ярмарка, которая начинается съ 15 Сентября , и продолжается недѣлю ; съ товарами пріѣзжаютъ изъ разныхъ ближиихъ городовъ , а именно изъ Москвы ,кзъ Переславля Залѣснаго , изъ Ярославля; изъ Катина и изъ смѣжныхъ мѣстъ. Товары оные состоятъ въ щепетьѣ, шапкахъ, сапогахъ и прочей всякой мѣлочи; также торговыхъ дней въ недѣлѣ бываетъ два: понедѣльникъ и четвер токъ.",
31,,,"ДОНКОВЪ, городъ Рязанскаго Намѣстничества. Бываютъ здѣсь двѣ въ году ярмарки : первая въ пятницу десятой , вторая въ пятницу второй надесять недѣли по Пасхѣ. Пріѣзжаютъ на оныя купцы съ разными мѣлочными товарами.",
